[
  {
    "id": "american-school-for-the-deaf",
    "type": "institution",
    "label": "American School for the Deaf",
    "alternativeLabels": [],
    "significanceSummary": "První trvalá škola pro neslyšící v USA, kterou zdroj spojuje s Gallaudetem a Clercem.",
    "disciplineIds": [
      "surdopedie"
    ],
    "tags": [
      "instituce"
    ],
    "sourceReferences": [
      {
        "sourceDocumentId": "mini-wikipedie-osobnosti-vs",
        "locator": "Thomas Hopkins Gallaudet",
        "excerpt": "American School for the Deaf"
      }
    ]
  },
  {
    "id": "analyticka-psychologie",
    "type": "approach",
    "label": "analytická psychologie",
    "alternativeLabels": [],
    "significanceSummary": "Směr explicitně spojený ve zdroji s Carlem Gustavem Jungem.",
    "disciplineIds": [
      "psychologie-psychiatrie-a-psychoterapie"
    ],
    "tags": [
      "psychoterapie"
    ],
    "sourceReferences": [
      {
        "sourceDocumentId": "mini-wikipedie-osobnosti-vs",
        "locator": "Carl Gustav Jung",
        "excerpt": "analytická psychologie"
      }
    ]
  },
  {
    "id": "andragogika",
    "type": "term",
    "label": "andragogika",
    "alternativeLabels": [],
    "significanceSummary": "Pojem, jehož první doložené užití zdroj spojuje s Alexandrem Kappem.",
    "disciplineIds": [
      "andragogika-a-gerontagogika"
    ],
    "tags": [
      "vymezeni-oboru"
    ],
    "sourceReferences": [
      {
        "sourceDocumentId": "mini-wikipedie-osobnosti-vs",
        "locator": "Alexandr Kapp",
        "excerpt": "andragogika"
      }
    ]
  },
  {
    "id": "asociace-klinickych-logopedu",
    "type": "institution",
    "label": "Asociace klinických logopedů",
    "alternativeLabels": [],
    "significanceSummary": "Profesní organizace připomenutá ve zdroji v souvislosti s Evou Škodovou.",
    "disciplineIds": [
      "logopedie"
    ],
    "tags": [
      "ceske-prostredi",
      "instituce",
      "klinicka-logopedie"
    ],
    "sourceReferences": [
      {
        "sourceDocumentId": "mini-wikipedie-osobnosti-vs",
        "locator": "Eva Škodová",
        "excerpt": "Asociace klinických logopedů"
      }
    ]
  },
  {
    "id": "aspergeruv-syndrom",
    "type": "diagnostic-class",
    "label": "Aspergerův syndrom",
    "alternativeLabels": [],
    "significanceSummary": "Historické označení připomenuté ve zdroji u Hanse Aspergera.",
    "disciplineIds": [
      "psychologie-psychiatrie-a-psychoterapie"
    ],
    "tags": [
      "autismus",
      "diagnostika"
    ],
    "sourceReferences": [
      {
        "sourceDocumentId": "mini-wikipedie-osobnosti-vs",
        "locator": "Hans Asperger",
        "excerpt": "Aspergerův syndrom"
      }
    ]
  },
  {
    "id": "augmentativni-a-alternativni-komunikace",
    "type": "term",
    "label": "augmentativní a alternativní komunikace",
    "alternativeLabels": [
      "AAK"
    ],
    "significanceSummary": "Oblast podpory funkční komunikace připomínaná ve zdroji u Blissymbolics, Makatonu a českých logopedů.",
    "disciplineIds": [
      "logopedie"
    ],
    "tags": [
      "aak",
      "komunikace"
    ],
    "sourceReferences": [
      {
        "sourceDocumentId": "mini-wikipedie-osobnosti-vs",
        "locator": "Charles Bliss",
        "excerpt": "augmentativní a alternativní komunikace"
      }
    ]
  },
  {
    "id": "autisticke-spektrum",
    "type": "term",
    "label": "autistické spektrum",
    "alternativeLabels": [],
    "significanceSummary": "Spektrální pojetí autismu připomenuté ve zdroji u Lorny Wingové.",
    "disciplineIds": [
      "psychologie-psychiatrie-a-psychoterapie"
    ],
    "tags": [
      "autismus",
      "diagnostika"
    ],
    "sourceReferences": [
      {
        "sourceDocumentId": "mini-wikipedie-osobnosti-vs",
        "locator": "Lorna Wingová",
        "excerpt": "autistické spektrum"
      }
    ]
  },
  {
    "id": "bakulovi-zpevacci",
    "type": "event",
    "label": "Bakulovi zpěváčci",
    "alternativeLabels": [],
    "significanceSummary": "Soubor připomenutý ve zdroji jako symbol Bakulovy výchovné metody.",
    "disciplineIds": [
      "somatopedie"
    ],
    "tags": [
      "instituce",
      "metody-prace"
    ],
    "sourceReferences": [
      {
        "sourceDocumentId": "mini-wikipedie-osobnosti-vs",
        "locator": "František Bakule",
        "excerpt": "Bakulovi zpěváčci"
      }
    ]
  },
  {
    "id": "bakuluv-ustav",
    "type": "institution",
    "label": "Bakulův ústav",
    "alternativeLabels": [],
    "significanceSummary": "Samostatný ústav pro výchovu životem a prací spojovaný ve zdroji s Františkem Bakulem.",
    "disciplineIds": [
      "somatopedie"
    ],
    "tags": [
      "ceske-prostredi",
      "instituce"
    ],
    "sourceReferences": [
      {
        "sourceDocumentId": "mini-wikipedie-osobnosti-vs",
        "locator": "František Bakule",
        "excerpt": "Bakulův ústav"
      }
    ]
  },
  {
    "id": "bayleyovy-skaly-raneho-vyvoje",
    "type": "scale",
    "label": "Bayleyovy škály raného vývoje",
    "alternativeLabels": [],
    "significanceSummary": "Škály uvedené ve zdroji jako nástroj rané vývojové diagnostiky.",
    "disciplineIds": [
      "diagnostika-a-psychometrie"
    ],
    "tags": [
      "diagnostika",
      "rany-vyvoj"
    ],
    "sourceReferences": [
      {
        "sourceDocumentId": "mini-wikipedie-osobnosti-vs",
        "locator": "Nancy Bayley",
        "excerpt": "Bayleyovy škály raného vývoje"
      }
    ]
  },
  {
    "id": "behaviorismus",
    "type": "approach",
    "label": "behaviorismus",
    "alternativeLabels": [],
    "significanceSummary": "Směr výkladu chování připomínaný ve zdroji u Watsona, Hulla a Skinnera.",
    "disciplineIds": [
      "psychologie-psychiatrie-a-psychoterapie"
    ],
    "tags": [
      "behaviorismus",
      "uceni"
    ],
    "sourceReferences": [
      {
        "sourceDocumentId": "mini-wikipedie-osobnosti-vs",
        "locator": "John B. Watson",
        "excerpt": "behaviorismus"
      }
    ]
  },
  {
    "id": "binet-simonova-skala",
    "type": "scale",
    "label": "Binet-Simonova škála",
    "alternativeLabels": [],
    "significanceSummary": "Raně inteligenční škála vytvořená podle zdroje Alfredem Binetem a Théodorem Simonem.",
    "disciplineIds": [
      "diagnostika-a-psychometrie"
    ],
    "tags": [
      "diagnostika",
      "psychometrie"
    ],
    "sourceReferences": [
      {
        "sourceDocumentId": "mini-wikipedie-osobnosti-vs",
        "locator": "Alfred Binet",
        "excerpt": "Binet-Simonova škála"
      }
    ]
  },
  {
    "id": "blissymbolics",
    "type": "communication-system",
    "label": "Blissymbolics",
    "alternativeLabels": [],
    "significanceSummary": "Symbolový komunikační systém spojovaný ve zdroji s Charlesem Blissem.",
    "disciplineIds": [
      "logopedie"
    ],
    "tags": [
      "aak",
      "komunikace"
    ],
    "sourceReferences": [
      {
        "sourceDocumentId": "mini-wikipedie-osobnosti-vs",
        "locator": "Charles Bliss",
        "excerpt": "Blissymbolics"
      }
    ]
  },
  {
    "id": "bodove-nocni-pismo",
    "type": "communication-system",
    "label": "bodové noční písmo",
    "alternativeLabels": [],
    "significanceSummary": "Soustava Josefa Julia Barbiera uvedená ve zdroji jako předstupeň Braillova písma.",
    "disciplineIds": [
      "tyflopedie"
    ],
    "tags": [
      "komunikace"
    ],
    "sourceReferences": [
      {
        "sourceDocumentId": "mini-wikipedie-osobnosti-vs",
        "locator": "Josef Julius Barbier",
        "excerpt": "bodové noční písmo"
      }
    ]
  },
  {
    "id": "braillovo-pismo",
    "type": "communication-system",
    "label": "Braillovo písmo",
    "alternativeLabels": [],
    "significanceSummary": "Šestibodová soustava, kterou zdroj spojuje s Louisem Braillem a moderní autonomií nevidomého čtenáře.",
    "disciplineIds": [
      "tyflopedie"
    ],
    "tags": [
      "komunikace"
    ],
    "sourceReferences": [
      {
        "sourceDocumentId": "mini-wikipedie-osobnosti-vs",
        "locator": "Louis Braille",
        "excerpt": "Braillovo písmo"
      }
    ]
  },
  {
    "id": "brocova-oblast",
    "type": "term",
    "label": "Brocova oblast",
    "alternativeLabels": [],
    "significanceSummary": "Mozková oblast spojovaná ve zdroji s Paulem Brocou a motorickou afázií.",
    "disciplineIds": [
      "logopedie"
    ],
    "tags": [
      "diagnostika",
      "neurologie"
    ],
    "sourceReferences": [
      {
        "sourceDocumentId": "mini-wikipedie-osobnosti-vs",
        "locator": "Paul Broca",
        "excerpt": "Brocova oblast"
      }
    ]
  },
  {
    "id": "defektologie",
    "type": "term",
    "label": "defektologie",
    "alternativeLabels": [],
    "significanceSummary": "Starší označení oboru, které zdroj používá jako kontrast k novějšímu širšímu pojetí speciální pedagogiky.",
    "disciplineIds": [
      "specialni-pedagogika-a-dejiny-oboru"
    ],
    "tags": [
      "historie-oboru",
      "vymezeni-oboru"
    ],
    "sourceReferences": [
      {
        "sourceDocumentId": "mini-wikipedie-osobnosti-vs",
        "locator": "Bohumír Justyn Popelář",
        "excerpt": "defektologie"
      }
    ]
  },
  {
    "id": "detska-psychiatrie",
    "type": "term",
    "label": "dětská psychiatrie",
    "alternativeLabels": [],
    "significanceSummary": "Oblast spojovaná ve zdroji s Karlem Herfortem a s medicínsko-pedagogickým propojením.",
    "disciplineIds": [
      "psychopedie"
    ],
    "tags": [
      "medicinsky-kontext"
    ],
    "sourceReferences": [
      {
        "sourceDocumentId": "mini-wikipedie-osobnosti-vs",
        "locator": "Karel Herfort",
        "excerpt": "dětská psychiatrie"
      }
    ]
  },
  {
    "id": "deylova-vychovna-slepych",
    "type": "institution",
    "label": "Deylova výchovna slepých",
    "alternativeLabels": [],
    "significanceSummary": "Instituce založená Janem Deylem podle zdroje.",